"bns_sections_subsections","subject","ipc_sections","summary_of_comparison"
"352","Intentional insult with intent to provoke breach of the peace.","504","Words “in any manner” are added."
"353","Statements conducing to public mischief.","505",""" false information”, “including through electronic means” are added."
"354","Act caused by inducing person to believe that he will be rendered an object of the Divine displeasure.","508","No change."
"355","Misconduct in public by a drunken person.","510","Fine is increased from ten rupees to one thousand, or with community service is added."
"356 (1)","Defamation.","499","IPC Section is included as a sub section."
"356 (2)","Defamation punishment.","500","IPC section is included as a sub-section in BNS sans heading. “or with community service” is added as an alternate punishment."
"356 (3)","Printing or engraving matter known to be defamatory.","501","IPC Section is included as a sub-section in BNS sans heading."
"356 (4)","Sale of printed or engraved substance containing defamatory matter.","502","No change."
"357","Breach of contract to attend on, supply wants of helpless person.","491","Fine increased from two hundred rupees to five thousand rupees."
"358","Repeal, Savings.","-","This section is a new addition. The Indian Penal Code, 1860, was enacted by the British Colonisers de novo; therefore, the Repeal, Savings Section was not required at all. Vide sub-section(1), subsequent Government of India notifications, the IPC will be repealed on 1st July 2024. However, sub-sections (2) to (4) stipulate savings related to the repealed code."
